{
  "$ref": "#/definitions/experiments",
  "definitions": {
    "experiments": {
      "type": "object",
      "properties": {
        "title": {
          "type": "string"
        },
        "tagline": {
          "type": "string"
        },
        "category": {
          "type": "string"
        },
        "date": {
          "type": "string"
        },
        "slug": {
          "type": "string"
        },
        "ogImage": {
          "type": "string"
        },
        "cover": {
          "type": "string"
        },
        "locale": {
          "type": "string",
          "enum": [
            "en",
            "fr"
          ],
          "default": "en"
        },
        "$schema": {
          "type": "string"
        }
      },
      "required": [
        "title",
        "tagline",
        "category",
        "date",
        "slug"
      ],
      "additionalProperties": false
    }
  },
  "$schema": "http://json-schema.org/draft-07/schema#"
}