{
  "title": "Les peptides sont-ils illégaux en France ? Ça dépend de leur statut.",
  "tagline": "La ligne entre médicament autorisé, produit de recherche et substance dont la détention est interdite.",
  "category": "Peptides",
  "date": "2026-09-02",
  "slug": "legalite-peptides",
  "cover": "/health-journey/blog/legalite-peptides-cover.png",
  "ogImage": "/health-journey/blog/legalite-peptides-cover.png",
  "locale": "fr"
}
