{
  "title": "Ma vie après avoir quitté ma startup",
  "tagline": "Mon départ de Lucis, les difficultés partagées par plus de 50 fondateurs et ce qui m'a aidé à avancer.",
  "category": "Fondateur",
  "date": "2026-10-30",
  "slug": "post-exit",
  "ogImage": "/health-journey/post-exit.webp",
  "cover": "/health-journey/post-exit.webp",
  "locale": "fr"
}
