{
  "title": "Je prends 11 compléments par jour",
  "tagline": "11 compléments reliés à mes analyses de sang. Trois systèmes étaient déréglés : hormones, thyroïde, inflammation. La liste complète, avec doses, horaires et produits.",
  "category": "Compléments",
  "date": "2026-04-09",
  "slug": "supplements",
  "cover": "/health-journey/banner-supplements.jpg",
  "locale": "fr"
}
