{
  "title": "I Take 11 Supplements a Day",
  "tagline": "11 supplements tied to my bloodwork. Three systems were broken: hormones, thyroid, inflammation. Full stack with doses, timing, and products.",
  "category": "Supplements",
  "date": "2026-04-09",
  "slug": "supplements",
  "cover": "/health-journey/banner-supplements.jpg"
}
