{
  "title": "Ozempic a fait vivre des souris 92 jours de plus. Ce que ça veut dire, et ce que ça ne veut pas dire.",
  "tagline": "Une étude Nature du 2 septembre 2026 : le sémaglutide allonge la vie de souris femelles âgées. La comparaison avec un régime est plus intéressante que le chiffre.",
  "category": "GLP-1",
  "date": "2026-09-06",
  "slug": "glp1-longevite-souris",
  "cover": "/health-journey/blog/glp1-longevite-souris-cover.png",
  "ogImage": "/health-journey/blog/glp1-longevite-souris-cover.png",
  "locale": "fr"
}