{
  "title": "7 conseils pour un sommeil de qualité",
  "tagline": "3 mois de suivi avec l'Ultrahuman Ring Air. Mon score de sommeil est passé de 82 à 100 en 15 jours. 7 changements qui ont eu un vrai effet.",
  "category": "Sommeil",
  "date": "2025-03-11",
  "slug": "sleep",
  "cover": "/health-journey/banner-sleep.jpg",
  "locale": "fr"
}
