{
  "title": "Are peptides legal in France? It depends on their status.",
  "tagline": "The line between an authorised medicine, a research product and a substance whose possession is prohibited.",
  "category": "Peptides",
  "date": "2026-09-02",
  "slug": "legalite-peptides",
  "cover": "/health-journey/blog/legalite-peptides-cover.png",
  "ogImage": "/health-journey/blog/legalite-peptides-cover.png"
}
