{
  "title": "31 Tips to Fix Low Testosterone",
  "tagline": "Nothing besides TRT will drastically increase levels. The key is lifestyle. 31 science-backed actions, organized into morning ritual, evening ritual, diet, training, and stress management.",
  "category": "Testosterone",
  "date": "2026-03-19",
  "slug": "testosterone",
  "cover": "/health-journey/banner-low-testosterone.jpg"
}
