{
  "title": "31 conseils pour corriger une faible testostérone",
  "tagline": "Rien, à part la TRT, n'augmentera drastiquement vos niveaux. La clé, c'est le mode de vie. 31 leviers appuyés par la littérature, entre routine, alimentation, entraînement et gestion du stress.",
  "category": "Testostérone",
  "date": "2026-03-19",
  "slug": "testosterone",
  "cover": "/health-journey/banner-low-testosterone.jpg",
  "locale": "fr"
}
