{
  "title": "What if a drug let you sleep 4 hours less?",
  "tagline": "The 2026 Lasker Award honors the discovery of orexin. A 1st drug, Lilly's $6.3 billion bet, and a hypothesis: a GLP-1 for sleep.",
  "category": "Sleep",
  "date": "2026-09-14",
  "slug": "orexine-dormir-moins",
  "cover": "/health-journey/blog/orexine-dormir-moins-cover.jpg",
  "ogImage": "/health-journey/blog/orexine-dormir-moins-cover.jpg"
}