{
  "title": "Mes biomarqueurs, bilan complet",
  "tagline": "Métabolisme, hormones, composition corporelle, force et âge biologique. 9,7 ans d'âge biologique de moins que mon âge réel. Rythme de vieillissement : 0,74.",
  "category": "Biomarqueurs",
  "date": "2026-05-08",
  "slug": "max-biomarkers",
  "cover": "/health-journey/banner-biomarkers.jpg",
  "ogImage": "https://maxguerois.com/health-journey/og/bloodwork.jpg",
  "locale": "fr"
}
