{
  "title": "My Biomarkers — Full Snapshot",
  "tagline": "Bio age 19. Pace of aging 0.74. Resting heart rate 40. VO2 Max 52.4. Full snapshot across metabolism, hormones, body composition, and strength.",
  "category": "Biomarkers",
  "date": "2026-05-08",
  "slug": "max-biomarkers",
  "cover": "/health-journey/banner-biomarkers.jpg",
  "ogImage": "https://maxguerois.com/health-journey/og/bloodwork.jpg"
}
