{
  "title": "Pourquoi l'industrie alimentaire se met aux protéines",
  "tagline": "McDonald's, Nestlé, Starbucks, Danone : ce que les GLP-1 changent dans les rayons.",
  "category": "GLP-1",
  "date": "2026-09-24",
  "slug": "glp1-proteines",
  "cover": "/health-journey/blog/glp1-proteines-banniere.jpg",
  "ogImage": "/health-journey/blog/glp1-proteines-banniere.jpg",
  "locale": "fr"
}
