{
  "title": "Why I stopped retatrutide after two weeks.",
  "tagline": "4.2 kg in two weeks, plenty of energy, and data heading the wrong way.",
  "category": "GLP-1",
  "date": "2026-08-30",
  "slug": "arreter-le-reta",
  "cover": "/health-journey/blog/arreter-reta-cover.jpg",
  "ogImage": "/health-journey/blog/arreter-reta-cover.jpg"
}
