{
  "title": "My Health OS: all my health data in one place, read by AI",
  "tagline": "Bloodwork, wearables, genome, all in one folder, read by an AI that tells you what to do. The full no-code how-to.",
  "category": "Data",
  "date": "2026-06-20",
  "slug": "health-os",
  "cover": "/health-journey/banner-health-os.jpg"
}
