{
  "title": "How GLP-1s are reshaping consumption",
  "tagline": "Airlines, food, alcohol, clothing, healthcare: the 5 industries GLP-1 drugs are changing.",
  "category": "GLP-1",
  "date": "2026-09-17",
  "slug": "glp1-economie",
  "cover": "/health-journey/blog/glp1-economie-banniere.jpg",
  "ogImage": "/health-journey/blog/glp1-economie-banniere.jpg"
}