{
  "title": "7 Tips for High-Quality Sleep",
  "tagline": "3 months of tracking with the Ultrahuman Ring Air. Took my sleep score from 82 to 100 in 15 days. 7 changes that actually moved the needle.",
  "category": "Sleep",
  "date": "2025-03-11",
  "slug": "sleep",
  "cover": "/health-journey/banner-sleep.jpg"
}
