{
  "title": "J'ai séquencé mon génome entier. Voici ce que j'ai trouvé.",
  "tagline": "La couche de base de tout ce que je fais pour ma santé. Ce qu'est vraiment un test ADN, ce que le mien a changé, et les trois étapes pour le faire toi-même.",
  "category": "Génome",
  "date": "2026-06-06",
  "slug": "my-genome",
  "cover": "/health-journey/dna/og-cheapest-measurement.jpg",
  "locale": "fr"
}
