{
  "title": "Ozempic added 92 days to the life of mice. What that means, and what it does not.",
  "tagline": "A Nature paper from September 2, 2026: semaglutide extends the lifespan of old female mice. The comparison with dieting is more interesting than the number.",
  "category": "GLP-1",
  "date": "2026-09-06",
  "slug": "glp1-longevite-souris",
  "cover": "/health-journey/blog/glp1-longevite-souris-cover.png",
  "ogImage": "/health-journey/blog/glp1-longevite-souris-cover.png"
}