{
  "title": "I sequenced my whole genome. Here's what I found.",
  "tagline": "The base layer under everything I do with my health. What a DNA test actually is, what mine changed, and the three steps to do it yourself.",
  "category": "Genome",
  "date": "2026-06",
  "slug": "i-sequenced-my-whole-genome"
}
