{
  "title": "Why the food industry is going all-in on protein",
  "tagline": "McDonald's, Nestlé, Starbucks, Danone: what GLP-1s are changing on supermarket shelves.",
  "category": "GLP-1",
  "date": "2026-09-24",
  "slug": "glp1-proteines",
  "cover": "/health-journey/blog/glp1-proteines-banniere.jpg",
  "ogImage": "/health-journey/blog/glp1-proteines-banniere.jpg"
}
