{
  "title": "Et si un médicament permettait de dormir 4 h de moins ?",
  "tagline": "Le prix Lasker 2026 récompense la découverte de l'orexine. Un 1er médicament, 6,3 milliards de Lilly, et une hypothèse : un GLP-1 du sommeil.",
  "category": "Sommeil",
  "date": "2026-09-14",
  "slug": "orexine-dormir-moins",
  "cover": "/health-journey/blog/orexine-dormir-moins-cover.jpg",
  "ogImage": "/health-journey/blog/orexine-dormir-moins-cover.jpg",
  "locale": "fr"
}