{
  "title": "Peptides and hair: what the science can actually support.",
  "tagline": "Regrowth, shedding, GHK-Cu, GLP-1s: what social media says, and what the evidence actually allows you to conclude.",
  "category": "Peptides",
  "date": "2026-08-28",
  "slug": "peptides-cheveux",
  "cover": "/health-journey/blog/peptides-cheveux-cover.png",
  "ogImage": "/health-journey/blog/peptides-cheveux-cover.png"
}
